{
  "$schema": "schemas/dependency-candidates-v1.schema.json",
  "schemaVersion": "1.0.0",
  "sourceManifestVersion": "1.0.0",
  "sourceManifestGeneratedAt": "2026-09-10T04:04:23.791236+00:00",
  "semantics": "textual-candidates-only",
  "records": [
    {
      "sourceAssetId": "AIShifuExpert",
      "candidates": [
        {
          "mentionedAs": "ai-shifu-course-creator",
          "status": "unresolved",
          "candidateAssetIds": [],
          "evidence": {
            "path": "skills/workbuddy/agent/ai-shifu--113b42b692/AGENT.md",
            "line": 17,
            "excerpt": "2. 调用 `ai-shifu-course-creator` 技能执行"
          }
        }
      ]
    },
    {
      "sourceAssetId": "AdCreativeStrategist",
      "candidates": [
        {
          "mentionedAs": "brand-guidelines",
          "status": "ambiguous",
          "candidateAssetIds": [
            "workbuddy-ai:skill:plugins__marketplaces__codebuddy-plugins-official__external_plugins__brand-guidelines__SKILL.md",
            "workbuddy-files:skill:plugins__marketplaces__codebuddy-plugins-official__external_plugins__brand-guidelines__SKILL.md"
          ],
          "evidence": {
            "path": "skills/workbuddy/agent/ad-creative-strategist--42501b630d/AGENT.md",
            "line": 76,
            "excerpt": "- **brand-guidelines**：品牌设计规范 — 当需要应用品牌配色和排版规范到设计产物时自动触发"
          }
        },
        {
          "mentionedAs": "humanizer",
          "status": "ambiguous",
          "candidateAssetIds": [
            "hermes:skill:hermes-agent__skills__creative__humanizer__SKILL.md",
            "hermes:skill:skills__creative__humanizer__SKILL.md",
            "workbuddy-ai:skill:plugins__marketplaces__codebuddy-plugins-official__plugins__hot-skills__skills__humanizer__SKILL.md",
            "workbuddy-files:skill:plugins__cache__workbuddy-builtin__tencent-docx__0.3.0__skills__humanizer__SKILL.md",
            "workbuddy-files:skill:plugins__marketplaces__codebuddy-plugins-official__plugins__hot-skills__skills__humanizer__SKILL.md"
          ],
          "evidence": {
            "path": "skills/workbuddy/agent/ad-creative-strategist--42501b630d/AGENT.md",
            "line": 77,
            "excerpt": "- **humanizer**：文本人性化处理 — 当需要去除文本中的 AI 写作痕迹、让内容更贴近真人写作风格时自动触发"
          }
        }
      ]
    },
    {
      "sourceAssetId": "AgentOrchestrator",
      "candidates": [
        {
          "mentionedAs": "github",
          "status": "ambiguous",
          "candidateAssetIds": [
            "claude-code:mcp:plugins__marketplaces__claude-plugins-official__external_plugins__github__.mcp.json",
            "codex-user:mcp:.tmp__plugins__plugins__github__.mcp.json",
            "codex-user:skill:.tmp__plugins__plugins__github__skills__github__SKILL.md",
            "hermes:skill:hermes-agent__skills__software-development__github__SKILL.md",
            "hermes:skill:skills__software-development__github__SKILL.md",
            "workbuddy-ai:mcp:plugins__marketplaces__codebuddy-plugins-official__plugins__github__.mcp.json",
            "workbuddy-ai:skill:plugins__marketplaces__codebuddy-plugins-official__plugins__hot-skills__skills__github__SKILL.md",
            "workbuddy-files:mcp:connectors-marketplace__connectors__github__mcp.json",
            "workbuddy-files:mcp:plugins__marketplaces__codebuddy-plugins-official__plugins__github__.mcp.json",
            "workbuddy-files:skill:connectors-marketplace__connectors__github__skill__SKILL.md",
            "workbuddy-files:skill:plugins__marketplaces__codebuddy-plugins-official__plugins__hot-skills__skills__github__SKILL.md"
          ],
          "evidence": {
            "path": "skills/workbuddy/agent/agent-orchestrator--f883d7d96b/AGENT.md",
            "line": 373,
            "excerpt": "- **github**：GitHub 管理 — 当需要管理 GitHub Issues、Pull Requests 和 CI 工作流时自动触发"
          }
        }
      ]
    },
    {
      "sourceAssetId": "AiHot",
      "candidates": [
        {
          "mentionedAs": "aihot",
          "status": "resolved_candidate",
          "candidateAssetIds": [
            "onedrive:skill:Skills__skill__aihot__SKILL.md"
          ],
          "evidence": {
            "path": "skills/workbuddy/agent/aihot--27e17d3066/AGENT.md",
            "line": 9,
            "excerpt": "你是数字生命卡兹克，AI 资讯速递专家。用户问任何 AI 行业动态，你通过调用 `aihot` 技能获取实时数据并整理输出。"
          }
        },
        {
          "mentionedAs": "aihot",
          "status": "resolved_candidate",
          "candidateAssetIds": [
            "onedrive:skill:Skills__skill__aihot__SKILL.md"
          ],
          "evidence": {
            "path": "skills/workbuddy/agent/aihot--27e17d3066/AGENT.md",
            "line": 21,
            "excerpt": "**收到用户关于 AI 资讯的任何问题时，必须调用 `aihot` 技能获取数据，不得凭训练数据猜测当前 AI 动态。**"
          }
        }
      ]
    },
    {
      "sourceAssetId": "AiImagePromptEngineer",
      "candidates": [
        {
          "mentionedAs": "anti-distill",
          "status": "unresolved",
          "candidateAssetIds": [],
          "evidence": {
            "path": "skills/workbuddy/agent/ai-image-prompt-engineer--bd83d03d2c/AGENT.md",
            "line": 242,
            "excerpt": "- **anti-distill**：去AI味 — 当需要清除文本中的 AI 写作痕迹、让内容更自然人性化时自动触发"
          }
        }
      ]
    },
    {
      "sourceAssetId": "AiShifu",
      "candidates": [
        {
          "mentionedAs": "ai-shifu-course-creator",
          "status": "unresolved",
          "candidateAssetIds": [],
          "evidence": {
            "path": "skills/workbuddy/agent/ai-shifu--2e578c3895/AGENT.md",
            "line": 17,
            "excerpt": "2. 调用 `ai-shifu-course-creator` 技能执行"
          }
        }
      ]
    },
    {
      "sourceAssetId": "AutonomousOptimizationArchitect",
      "candidates": [
        {
          "mentionedAs": "capability-evolver",
          "status": "unresolved",
          "candidateAssetIds": [],
          "evidence": {
            "path": "skills/workbuddy/agent/autonomous-optimization-architect--f3d63f848e/AGENT.md",
            "line": 113,
            "excerpt": "- **capability-evolver**：AI Agent 自进化引擎 — 当需要分析运行历史、识别改进点并持续优化工作流程时自动触发"
          }
        },
        {
          "mentionedAs": "browser-use",
          "status": "unresolved",
          "candidateAssetIds": [],
          "evidence": {
            "path": "skills/workbuddy/agent/autonomous-optimization-architect--f3d63f848e/AGENT.md",
            "line": 114,
            "excerpt": "- **browser-use**：浏览器自动化 — 当需要网页自动化操作、导航、点击、截图、数据提取时自动触发"
          }
        }
      ]
    },
    {
      "sourceAssetId": "BaiduSeoExpert",
      "candidates": [
        {
          "mentionedAs": "anti-distill",
          "status": "unresolved",
          "candidateAssetIds": [],
          "evidence": {
            "path": "skills/workbuddy/agent/baidu-seo-expert--0bdb712bc2/AGENT.md",
            "line": 232,
            "excerpt": "- **anti-distill**：去AI味 — 当需要清除文本中的 AI 写作痕迹、让内容更自然人性化时自动触发"
          }
        },
        {
          "mentionedAs": "marketing-skills",
          "status": "unresolved",
          "candidateAssetIds": [],
          "evidence": {
            "path": "skills/workbuddy/agent/baidu-seo-expert--0bdb712bc2/AGENT.md",
            "line": 233,
            "excerpt": "- **marketing-skills**：营销技能库 — 当需要执行 CRO、SEO、文案撰写、数据分析、实验设计、定价策略、产品发布等营销任务时自动触发"
          }
        }
      ]
    },
    {
      "sourceAssetId": "BehavioralNudgeEngine",
      "candidates": [
        {
          "mentionedAs": "anti-distill",
          "status": "unresolved",
          "candidateAssetIds": [],
          "evidence": {
            "path": "skills/workbuddy/agent/behavioral-nudge-engine--1f05211852/AGENT.md",
            "line": 86,
            "excerpt": "- **anti-distill**：去AI味 — 当需要清除文本中的 AI 写作痕迹、让内容更自然人性化时自动触发"
          }
        },
        {
          "mentionedAs": "fbs-bookwriter",
          "status": "unresolved",
          "candidateAssetIds": [],
          "evidence": {
            "path": "skills/workbuddy/agent/behavioral-nudge-engine--1f05211852/AGENT.md",
            "line": 87,
            "excerpt": "- **fbs-bookwriter**：长文档手稿工具链 — 当需要创作书籍、手册、白皮书、行业指南等长文档，支持联网查证和分层审校时自动触发"
          }
        }
      ]
    },
    {
      "sourceAssetId": "BiddingStrategist",
      "candidates": [
        {
          "mentionedAs": "bidding-strategist",
          "status": "unresolved",
          "candidateAssetIds": [],
          "evidence": {
            "path": "skills/workbuddy/agent/bidding-strategist--6f289342e8/AGENT.md",
            "line": 59,
            "excerpt": "调用 `bidding-strategist` skill 获取以下三份完整模板并按需生成："
          }
        }
      ]
    },
    {
      "sourceAssetId": "BilibiliContentStrategist",
      "candidates": [
        {
          "mentionedAs": "marketing-skills",
          "status": "unresolved",
          "candidateAssetIds": [],
          "evidence": {
            "path": "skills/workbuddy/agent/bilibili-content-strategist--d9545ca2c2/AGENT.md",
            "line": 205,
            "excerpt": "- **marketing-skills**：营销技能库 — 当需要执行 CRO、SEO、文案撰写、数据分析、实验设计、定价策略、产品发布等营销任务时自动触发"
          }
        }
      ]
    },
    {
      "sourceAssetId": "BookCoCreator",
      "candidates": [
        {
          "mentionedAs": "fbs-bookwriter",
          "status": "unresolved",
          "candidateAssetIds": [],
          "evidence": {
            "path": "skills/workbuddy/agent/book-co-creator--d4acbbb905/AGENT.md",
            "line": 116,
            "excerpt": "- **fbs-bookwriter**：长文档手稿工具链 — 当需要创作书籍、手册、白皮书、行业指南等长文档，支持联网查证和分层审校时自动触发"
          }
        },
        {
          "mentionedAs": "anti-distill",
          "status": "unresolved",
          "candidateAssetIds": [],
          "evidence": {
            "path": "skills/workbuddy/agent/book-co-creator--d4acbbb905/AGENT.md",
            "line": 117,
            "excerpt": "- **anti-distill**：去AI味 — 当需要清除文本中的 AI 写作痕迹、让内容更自然人性化时自动触发"
          }
        }
      ]
    },
    {